[
  {
    "schema_version": "1.0.0",
    "id": "alias:monstera_deliciosa_scientific",
    "value": "Monstera deliciosa",
    "normalized_value": "monstera deliciosa",
    "language": "la",
    "plant_id": "plant:monstera_deliciosa",
    "alias_type": "scientific_name",
    "automatic": true,
    "provenance": "taxonomy_source",
    "source_ids": ["source:gbif_monstera_deliciosa"],
    "review_status": "approved"
  },
  {
    "schema_version": "1.0.0",
    "id": "alias:monstera_deliciosa_zh",
    "value": "龟背竹",
    "normalized_value": "龟背竹",
    "language": "zh-CN",
    "plant_id": "plant:monstera_deliciosa",
    "alias_type": "project_alias",
    "automatic": true,
    "provenance": "project_curated",
    "source_ids": [],
    "review_status": "approved",
    "evaluation_status": "untested",
    "notes": "产品中文词表；正式发布前应再以中文植物志来源复核。"
  },
  {
    "schema_version": "1.0.0",
    "id": "alias:monstera_deliciosa_swiss_cheese",
    "value": "Swiss cheese plant",
    "normalized_value": "swiss cheese plant",
    "language": "en",
    "plant_id": "plant:monstera_deliciosa",
    "alias_type": "common_name",
    "automatic": true,
    "provenance": "care_source",
    "source_ids": ["source:ncsu_monstera_deliciosa"],
    "review_status": "approved"
  },
  {
    "schema_version": "1.0.0",
    "id": "alias:monstera_scope_shorthand",
    "value": "monstera",
    "normalized_value": "monstera",
    "language": "en",
    "plant_id": "plant:monstera_deliciosa",
    "alias_type": "project_alias",
    "automatic": true,
    "provenance": "project_curated",
    "source_ids": [],
    "review_status": "approved",
    "notes": "仅在当前单一 Monstera 物种的项目范围内自动映射；扩充同属物种前必须改为歧义匹配。"
  },
  {
    "schema_version": "1.0.0",
    "id": "alias:monstera_deliciosa_split_leaf",
    "value": "split-leaf philodendron",
    "normalized_value": "split leaf philodendron",
    "language": "en",
    "plant_id": "plant:monstera_deliciosa",
    "alias_type": "common_name",
    "automatic": true,
    "provenance": "care_source",
    "source_ids": ["source:ncsu_monstera_deliciosa"],
    "review_status": "approved",
    "notes": "历史性俗名；并不表示该物种属于 Philodendron 属。"
  },
  {
    "schema_version": "1.0.0",
    "id": "alias:pothos_scientific",
    "value": "Epipremnum aureum",
    "normalized_value": "epipremnum aureum",
    "language": "la",
    "plant_id": "plant:epipremnum_aureum",
    "alias_type": "scientific_name",
    "automatic": true,
    "provenance": "taxonomy_source",
    "source_ids": ["source:gbif_epipremnum_aureum"],
    "review_status": "approved"
  },
  {
    "schema_version": "1.0.0",
    "id": "alias:pothos_zh",
    "value": "绿萝",
    "normalized_value": "绿萝",
    "language": "zh-CN",
    "plant_id": "plant:epipremnum_aureum",
    "alias_type": "project_alias",
    "automatic": true,
    "provenance": "project_curated",
    "source_ids": [],
    "review_status": "approved",
    "evaluation_status": "untested",
    "notes": "产品中文词表；正式发布前应再以中文植物志来源复核。"
  },
  {
    "schema_version": "1.0.0",
    "id": "alias:pothos_common",
    "value": "pothos",
    "normalized_value": "pothos",
    "language": "en",
    "plant_id": "plant:epipremnum_aureum",
    "alias_type": "common_name",
    "automatic": true,
    "provenance": "taxonomy_source",
    "source_ids": ["source:gbif_epipremnum_aureum"],
    "review_status": "approved"
  },
  {
    "schema_version": "1.0.0",
    "id": "alias:pothos_golden",
    "value": "golden pothos",
    "normalized_value": "golden pothos",
    "language": "en",
    "plant_id": "plant:epipremnum_aureum",
    "alias_type": "common_name",
    "automatic": true,
    "provenance": "taxonomy_source",
    "source_ids": ["source:gbif_epipremnum_aureum"],
    "review_status": "approved"
  },
  {
    "schema_version": "1.0.0",
    "id": "alias:pothos_devils_ivy",
    "value": "devil's ivy",
    "normalized_value": "devils ivy",
    "language": "en",
    "plant_id": "plant:epipremnum_aureum",
    "alias_type": "common_name",
    "automatic": true,
    "provenance": "taxonomy_source",
    "source_ids": ["source:gbif_epipremnum_aureum"],
    "review_status": "approved"
  },
  {
    "schema_version": "1.0.0",
    "id": "alias:pothos_aureus_synonym",
    "value": "Pothos aureus",
    "normalized_value": "pothos aureus",
    "language": "la",
    "plant_id": "plant:epipremnum_aureum",
    "alias_type": "taxonomic_synonym",
    "automatic": true,
    "provenance": "taxonomy_source",
    "source_ids": ["source:gbif_epipremnum_aureum"],
    "review_status": "approved"
  },
  {
    "schema_version": "1.0.0",
    "id": "alias:scindapsus_aureus_synonym",
    "value": "Scindapsus aureus",
    "normalized_value": "scindapsus aureus",
    "language": "la",
    "plant_id": "plant:epipremnum_aureum",
    "alias_type": "taxonomic_synonym",
    "automatic": true,
    "provenance": "taxonomy_source",
    "source_ids": ["source:gbif_epipremnum_aureum"],
    "review_status": "approved"
  },
  {
    "schema_version": "1.0.0",
    "id": "alias:pothos_huangjinge",
    "value": "黄金葛",
    "normalized_value": "黄金葛",
    "language": "zh-CN",
    "plant_id": "plant:epipremnum_aureum",
    "alias_type": "project_alias",
    "automatic": true,
    "provenance": "project_curated",
    "source_ids": [],
    "review_status": "approved",
    "evaluation_status": "untested",
    "notes": "地区性俗名；正式发布前需补中文权威来源。"
  },
  {
    "schema_version": "1.0.0",
    "id": "alias:pothos_moguiteng",
    "value": "魔鬼藤",
    "normalized_value": "魔鬼藤",
    "language": "zh-CN",
    "plant_id": "plant:epipremnum_aureum",
    "alias_type": "project_alias",
    "automatic": true,
    "provenance": "project_curated",
    "source_ids": [],
    "review_status": "approved",
    "evaluation_status": "untested",
    "notes": "产品中文词表；对应英文俗名 devil's ivy。"
  },
  {
    "schema_version": "1.0.0",
    "id": "alias:snake_plant_scientific",
    "value": "Dracaena trifasciata",
    "normalized_value": "dracaena trifasciata",
    "language": "la",
    "plant_id": "plant:dracaena_trifasciata",
    "alias_type": "scientific_name",
    "automatic": true,
    "provenance": "taxonomy_source",
    "source_ids": ["source:gbif_dracaena_trifasciata"],
    "review_status": "approved"
  },
  {
    "schema_version": "1.0.0",
    "id": "alias:snake_plant_sansevieria",
    "value": "Sansevieria trifasciata",
    "normalized_value": "sansevieria trifasciata",
    "language": "la",
    "plant_id": "plant:dracaena_trifasciata",
    "alias_type": "taxonomic_synonym",
    "automatic": true,
    "provenance": "taxonomy_source",
    "source_ids": ["source:gbif_dracaena_trifasciata"],
    "review_status": "approved"
  },
  {
    "schema_version": "1.0.0",
    "id": "alias:snake_plant_sansevieria_shorthand",
    "value": "sansevieria",
    "normalized_value": "sansevieria",
    "language": "en",
    "plant_id": "plant:dracaena_trifasciata",
    "alias_type": "project_alias",
    "automatic": true,
    "provenance": "project_curated",
    "source_ids": [],
    "review_status": "approved",
    "notes": "仅在当前项目范围内映射到虎尾兰；加入其他原 Sansevieria 物种时必须重新消歧。"
  },
  {
    "schema_version": "1.0.0",
    "id": "alias:snake_plant_zh",
    "value": "虎尾兰",
    "normalized_value": "虎尾兰",
    "language": "zh-CN",
    "plant_id": "plant:dracaena_trifasciata",
    "alias_type": "project_alias",
    "automatic": true,
    "provenance": "project_curated",
    "source_ids": [],
    "review_status": "approved",
    "evaluation_status": "untested"
  },
  {
    "schema_version": "1.0.0",
    "id": "alias:snake_plant_hupilan",
    "value": "虎皮兰",
    "normalized_value": "虎皮兰",
    "language": "zh-CN",
    "plant_id": "plant:dracaena_trifasciata",
    "alias_type": "project_alias",
    "automatic": true,
    "provenance": "project_curated",
    "source_ids": [],
    "review_status": "approved",
    "evaluation_status": "untested"
  },
  {
    "schema_version": "1.0.0",
    "id": "alias:snake_plant_common",
    "value": "snake plant",
    "normalized_value": "snake plant",
    "language": "en",
    "plant_id": "plant:dracaena_trifasciata",
    "alias_type": "common_name",
    "automatic": true,
    "provenance": "taxonomy_source",
    "source_ids": ["source:gbif_dracaena_trifasciata"],
    "review_status": "approved"
  },
  {
    "schema_version": "1.0.0",
    "id": "alias:snake_plant_mother_in_law",
    "value": "mother-in-law's tongue",
    "normalized_value": "mother in laws tongue",
    "language": "en",
    "plant_id": "plant:dracaena_trifasciata",
    "alias_type": "common_name",
    "automatic": true,
    "provenance": "taxonomy_source",
    "source_ids": ["source:gbif_dracaena_trifasciata"],
    "review_status": "approved"
  },
  {
    "schema_version": "1.0.0",
    "id": "alias:qiansuilan_ambiguous",
    "value": "千岁兰",
    "normalized_value": "千岁兰",
    "language": "zh-CN",
    "plant_id": null,
    "alias_type": "ambiguous",
    "automatic": false,
    "provenance": "project_curated",
    "source_ids": [],
    "review_status": "needs_review",
    "evaluation_status": "untested",
    "notes": "禁止自动映射。该中文名常指 Welwitschia mirabilis，也可能在非规范商业语境中被用于虎尾兰。"
  }
]
